Артикул,Товар,Категорія,Опис
RP001,Шампунь Anti-Dundruff,,
RP002,безсульфатний шампунь з гідролізатом шовку та аргановою олією,,
RP003,безсульфатний шампунь з кератином та провітаміном В5,,
RP004,безсульфатний шампунь проти випадіння волосся з ніцинамідом та пребіотиком,,
RP005,Шампунь Argan Oil + Keratin,,
RP006,Кондиціонер для волосся Argan Oil + Keratin,,
RP007,Маска для волосся Argan Oil + Keratin,,
RP008,Шампунь Jojoba+Peptide Complex,,
RP009,Кондиціонер для волосся Jojoba+Peptide Complex,,
RP010,Маска для волосся Jojoba+Peptide Complex,,
RP011,Шампунь Macadamia+Omega Complex,,
RP012,Кондиціонер для волосся Macadamia+Omega Complex,,
RP013,Маска для волосся Macadamia+Omega Complex,,
RP014,Шампунь Avocado + Collagen,,
RP015,Кондиціонер для волосся Avocado + Collagen,,
RP016,Маска для волосся Avocado + Collagen,,
RP017,Шампунь глибокої очисти Рн 8,,
RP018,"Спрей відновлюючий з керамідами, амінокислотами та екстрактами проти випадіння волосся",,
RP019,Пілінг для шкіри голови,,
RP020,Арганова олія для кінчиків волосся,,
RP021,Термозахист з рідким кератином та амінокислотами,,
RP022,Крем-термозахист,,
RP023,"Баттер для тіла з оліями ши, кокосу, мигдалю та персика",,
RP024,"Крем-суфле для тіла зі скваланом, маслом ши та мигдальною олією",,
RP025,"Крем для рук з олією ши, кокосу, оливи та пом'якшувальними компонентами",,
RP026,"Шиммер Body Shimmer Gold, Bronze, Pearl, Pink",,
RP027,"Скраб для тіла сольовий, насичений оліями з шиммером",,
RP028,Скраб для тіла цукровий гідрофільний,,
RP029,Пінна сіль дла ванни.ю колори і аромати в асс,,
RP030,Тверда піна дла ванни.ю колори і віддушки асорт,,
RP032,"Гель для душу, фруктові та парфумерні композиціі",,
RP033,Лосьон для тіла з олією кокосу і авокадо,,
RP034,Гаряче антицелюлітне обгортання,,
RP035,Холодне антицелюлітне обгортання,,
RP036,Антицелюлітная персикова олія,,
RP037,"Крем массажний для салонних процедур, лимфодренуючим ефектом",,
RP038,Натуральний дезодорант,,
RP039,Олія массажна,,
RP040,Сироватка для обличчя Niacinamide Serum,,
RP041,Сироватка для обличчя Vitamin C+Ceramide Serum,,
RP042,Сироватка для обличчя Hyaluronic+Squalane Serum,,
RP043,Тонік для обличчя Nicanamide Toner,,
RP044,Тонік для обличчя Glycolic AHA Toner,,
RP045,Тонік для обличчя Hyaluronic Toner,,
RP046,Пінка для вмивання чутливої шкіри Face Foam Allantoin+Panthenol,,
RP047,Пінка для вмивання проблемної шкіри Face Foam Niacinamide+Rosmary,,
RP048,Гель для вмивання проблемної шкіри Cleansing Gel Inulin+Hyaluronic,,
RP049,Гідрофільна олія проблемної шкіри Hydropolic Oil Rosemary+Thyme,,
RP050,Гідрофільна олія чутливої шкіри (олеогель) Hydropolic Oil,,
RP051,Міцелярна вода Micellar Water Rosewood Essential,,
RP052,Зволожуючий крем для обличчя Aqua Face Cream,,
RP053,Відновлюючий крем для обличчя Bacuchiol Face Cream,,
RP054,"Нічний поживнний крем для обличчяз фітостерилом, олієм мурумуру та камелією Face Cream",,
RP055,"Крем Retreat з аміноцерамідами, алантоїном",,
RP056,Крем для шкіри навколо очей Bacuchiol Eye Cream,,
RP057,Бальзам для губ,,
RP058,Пілінг-диски,,
RP059,Маска для волосся кератин і шовк (біла),,
RP060,Маска для волосся кераміди і шовк (зелена),,
RP061,Бальзам-кондиціонер з пребіотиком,,
RP062,Тонік розмариновий для волосся,,
RP064,Кондиціонер для волосся чорний,,
RP065,Крем для рук 145-1-3,,
RP066,Шампунь Coconut + Milk,,
RP067,Кондиціонер Coconut + Milk,,
RP068,"Гель для душу, бюджетний, 273-1",,
RP069,Гель-крем зволожуючий,,
RP070,Скраб сольовий з мигдалем Crumb,,
RP082,Шампунь твердий евкаліпт 207-3-2,,
RP091,Розігріваючий гель для тіла cellulite killer,,
RP092,Зимовий крем для рук Crumb 188-3,,
RP098,Пілінг тонер AHA+BHA 10%,,
RP100,Рідина для кутікули,,
RP101,Суха олія для тіла,,
RP102,Масажна олія 2,,
RP103,Масажна олія 1,,
RP104,Масажна олія 3,,
RP105,Батер для тіла crumb,,
RP106,Дезодорант кульковий,,
RP107,Лосьон для тіла зволожуючий,,
RP108,Скраб матча Crumb,,
RP109,Гель-скраб Crumb,,
RP109,Спрей з усьмою 263,,
RP110,Молочко для ванної,,
RP111,Ліпідна маска для волосся,,
RP112,Маска правки,,
RP113,Бальзам для губ регенеруючий №4,,
RP114,Крем для рук Crumb 188-5,,
RP115,Крем звітамиіном С,,
RP116,Лосьон для тіла crumb 188-7,,
RP117,Натуральне гель-мило,,
RP118,Скраб lunnitsa,,
RP120,"крем з керамідами, фарміно",,
RP121,"Крем для рук з пантенолом, центелою та пребіотиком 294-1",,
RP125,Гель для тіла crumb,,
RP126,Крем для обличчя з spf 15,,
RP127,Лосьон для тіла з SPF30,,
RP128,Лосьон для тіла з SPF30 crumb 254-5,,
RP129,Пінка для душу,,
RP130,"Концентрат з усьмою, розмарином oila",,
RP131,Олійна сироватка усьми (в тубах зі щіточкою) 11 мл,,
RP133,Лосьйон для тіла лямелярний 320-3,,
RP134,Ензимна пудра,,
RP135,Міст для тіла з SPF Crumb 510-5,,
RP136,Шампунь Biotin MuruMuru,,
RP137,Кондиціонер для волосся Biotin MuruMuru,,
RP138,Полуничний ополіскувач 310-4,,
RP139,Пінка для кутикули RP139,,
RP140,Шампунь твердий банановий,,
RP141,Міст для тіла і обличчя з шиммером 304-2,,
RP143,Шампунь Detox з вугіллям,,
RP145,Маска для волосся з ламінарією oila,,
RP146,Сироватка для обиччя oila,,
RP147,ліпідна маска 502-1 контрактне,,
RP148,Крем для обличчя 003 oila,,
RP149,Гель для обличчя oila,,
RP150,Гель для душу Love Loss,,
RP151,Крем для тіла Love Loss,,
RP152,Суха олійка oila,,
RP153,"Сироватка для обличчя з центелою, пептидами та фітостеролами",,
RP154,Пінка ензимна для волосся та шкіри голови 527-1,,
RP155,Гель-пілінг 523-1,,
RP156,Крем-бальзам для губ та під очі 308-4,,
RP157,Мило для рук,,
RP158,"Інтимний гель Plis me, антибактеріальний",,
RP159,Лубрикант,,
RP160,"RP160 Маска для обличчя ліпідна з керамідами, кремова",,
RP161,RP161 Маска для обличчя гідрогелева 318-1,,
RP162,"RP162 Маска для обличчя глиняна, 322-2",,
RP163,Дезодорант LoveLoss,,
RP164,Крем-ліфтинг для інтимних зон,,
RP165,маска лід love loss,,
RP167,Крем лямелярний для обличчя 344-1,,
RP168,рідкий дезодорант plis me,,
RP169,"Інтимний гель Plis me, дезодоруючий",,
RP170,Сироватка з міорелаксантами,,
RP171,пінка для вмивання 343-1,,
RP172,Крем для обличчя коньяк маннан 348-4,,
RP173,Тонік для чутливої шкіри з центелою 353-1,,
RP174,Крем для обличчя з центелою 355-1,,
RP175,Сироватка з мигдальною кислотою 349-1,,
RP176,Сироватка зволожувальна з центелою 354-2,,
RP177,Крем для рук з бджолинним воском Mak Malvy,,
RP178,сульфатний твердий шампунь oila,,
RP179,безсульфатний твердий шампунь oila,,
RP180,Крем для ніг crumb,,
RP181,Сироватка для обличчя лямілярна з бакучіолом 347-1,,
RP182,"Лубрикант Plis me, зволожуючий 531-3",,
RP183,"Лубрикант Plis me, поживний 531-2",,
RP184,Незмивний ліпосомний спрей для волосся,,
RP185,Незмивна мульті-маска leave-in 15в1,,
RP186,Ліпідна маска для волосся з медом,,
RP187,Маска для губ з медом,,
RP188,Маска для губ,,
RP190,Конопляне обгортання для волосся з амінокислотами Amino Acid+Hemp,,
RP191,Шампунь зволожуючий для волосся Hyaluron +Watermelon,,
RP192,Маска екстразволожуюча 5d для волосся Hyaluron +Watermelon,,
RP193,Шампунь освіжаючий для волосся Rozemary+Guar+Almond,,
RP194,Термомаска для волосся Rozemary+Guar+Almond 373-2,,
RP195,Гель для вмивання К22,,
RP196,Гаряча олійка для волосся Hot oil treatment,,
RP197,Пінка для інтимної гігієни,,
RP198,Краплі для засмаги,,
RP199,Крем для обличчя 345,,
RP200,парфумований спрей для текстилю,,
RP201,гель для інтимної гігієни антибактеріальний plis me,,
RP202,гель для інтимної гігієни дезодоруючий plis me,,
RP203,"Тонік для обличчя з трегалозою, заспокійливий",,
RP204,Шампунь реконструюючий для волосся Amino Acid+Hemp,,
RP205,Крем для відбілення інтимних зон 544-1,,
RP206,"Скраб для тіла сольовий, мята евкаліпт",,
RP207,Лосьон luna з шимером very berry,,
RP208,Лосьон luna lost cherry,,
L300,"Тонік Retreat з ніацинамідом та екстрактом лотоса, відновлюючий, 150 мл",,-
L301,"Тонік Rich, з есцином та трояндою, поживний, 150 мл",,-
